Propriedade,Agrupando Por :,Descrição,Tags,Tarefa principal
Cadastros sem Representante,nan,Número de cadastros que não foram vinculadas a um representante.,nan,Aplicativo Comissão de Venda 
Cadastros sem Funcionários,nan,Número de cadastros sem funcionário vinculado.,nan,Aplicativo Comissão de Venda 
Serviços sem Funcionário,"Cliente , Serviço ",Número de serviços onde o funcionário responsável não foi informado.,nan,Aplicativo Mecânica 
Próximos do Vencimento,Cliente ,Número de contratos próximos do vencimento.,nan,Aplicativo Contratos 
Excluídas,"Cliente , Funcionário ",Número de propostas de vendas que foram excluídas no período.,nan,Aplicativo Proposta 
Alteradas Após Emissão de Nota,"Funcionário , Cliente , Fornecedor , Produto ",Número de devoluções que foram alteradas após a emissão de nota fiscal.,nan,Aplicativo Devolução 
Tarefa,nan,nan,nan,Aplicativo NFS-e 
